{
  "schemaVersion": "1.0.0",
  "status": "resolved",
  "requestedProfiles": [
    "runtime/node",
    "package-manager/npm",
    "language/typescript",
    "framework/react",
    "framework/nextjs-app-router",
    "test/vitest-rtl",
    "test/playwright",
    "quality/react-doctor",
    "ci/github-actions",
    "deployment/vercel",
    "observability/web-basic"
  ],
  "resolvedProfiles": [
    "runtime/node",
    "package-manager/npm",
    "language/typescript",
    "framework/react",
    "framework/nextjs-app-router",
    "test/vitest-rtl",
    "test/playwright",
    "quality/react-doctor",
    "ci/github-actions",
    "deployment/vercel",
    "observability/web-basic"
  ],
  "commands": {
    "runtimeVersion": "node --version",
    "install": "npm ci",
    "typecheck": "npm run typecheck",
    "lint": "npm run lint",
    "build": "npm run build",
    "unit": "npm run test:unit",
    "e2e": "npm run test:e2e",
    "reactDoctor": "npm run verify:react"
  },
  "checks": [
    "runtimeVersion",
    "lint",
    "typecheck",
    "build",
    "unit",
    "e2e",
    "reactDoctor"
  ],
  "capabilities": [
    "process-execution",
    "dependency-install",
    "static-analysis",
    "browser-ui",
    "server-rendering",
    "route-handlers",
    "unit-test",
    "component-test",
    "browser-automation",
    "react-diagnostics",
    "ci",
    "preview-deployment",
    "production-deployment",
    "logs",
    "metrics",
    "traces-optional"
  ],
  "riskControls": [
    "node-lts-required",
    "single-npm-lockfile",
    "install-requires-approved-foundation-task",
    "strict-mode",
    "accessible-interactions",
    "client-boundary-review",
    "server-client-boundary",
    "metadata-and-404",
    "deterministic-tests",
    "preview-before-production",
    "normalized-evidence",
    "no-remote-instruction-authority",
    "least-privilege",
    "sha-pin-external-reusable-workflows",
    "production-human-approval",
    "rollback-target-required",
    "no-secrets-in-signals",
    "bounded-retention"
  ],
  "registrySha256": "faabddc5f5eaa1ad1a0387606b6fd2829e7276ded1032a390b6f4da21e2c299a",
  "generatedAt": "2026-08-06T14:03:04.590Z"
}
